{
  "schemaVersion": "1.0.0",
  "kind": "recipeDefinition",
  "recipeId": 102,
  "name": "Crystal Bow Weapon Recipe",
  "outputKind": 4,
  "outputId": 2,
  "outputAmount": 1,
  "requiredFaction": 0,
  "requiredDistrictKind": 0,
  "requiredBuildingId": 0,
  "requiredTechTier": 2,
  "rarityTier": 2,
  "frameTier": 2,
  "requiresDiscovery": false,
  "enabled": true,
  "costs": [
    {
      "resourceId": 0,
      "amount": 125
    },
    {
      "resourceId": 2,
      "amount": 40
    },
    {
      "resourceId": 3,
      "amount": 15
    },
    {
      "resourceId": 6,
      "amount": 35
    }
  ],
  "resourceCostsRaw": [
    125,
    0,
    40,
    15,
    0,
    0,
    35,
    0,
    0,
    0
  ],
  "metadataRevision": 1,
  "verificationStatus": "confirmed",
  "notes": "Synced from live CityCrafting."
}
