{
    "schemaVersion": "1.0.0",
    "kind": "recipeDefinition",
    "recipeId": 9,
    "name": "Resonance Grip Recipe",
    "slug": "resonance-grip-recipe",
    "description": "Component crafting recipe for Resonance Grip in the live Inpinity City system.",
    "outputKind": 2,
    "outputId": 9,
    "outputAmount": 1,
    "requiredFaction": 0,
    "requiredDistrictKind": 0,
    "requiredBuildingId": 0,
    "requiredTechTier": 3,
    "rarityTier": 0,
    "frameTier": 0,
    "requiresDiscovery": false,
    "costs": [
      { "resourceId": 0, "amount": 35 },
      { "resourceId": 6, "amount": 10 },
      { "resourceId": 8, "amount": 5 }
    ],
    "resourceCostsRaw": [35, 0, 0, 0, 0, 0, 10, 0, 5, 0],
    "metadataRevision": 1,
    "enabled": true,
    "verificationStatus": "confirmed",
    "notes": "Confirmed from live CityCrafting recipeOf(9) and getRecipeCosts(9).",
    "display": {
      "outputKindLabel": "Component",
      "requiredFactionLabel": "None",
      "requiredDistrictKindLabel": "None",
      "requiredTechTierLabel": "Advanced",
      "rarityLabel": "None",
      "frameTierLabel": "None"
    }
  }