{
    "schemaVersion": "1.0.0",
    "kind": "recipeDefinition",
    "recipeId": 2,
    "name": "Reinforced Hilt Recipe",
    "slug": "reinforced-hilt-recipe",
    "description": "Component crafting recipe for Reinforced Hilt in the live Inpinity City system.",
    "outputKind": 2,
    "outputId": 2,
    "outputAmount": 1,
    "requiredFaction": 0,
    "requiredDistrictKind": 0,
    "requiredBuildingId": 0,
    "requiredTechTier": 1,
    "rarityTier": 0,
    "frameTier": 0,
    "requiresDiscovery": false,
    "costs": [
      { "resourceId": 0, "amount": 30 },
      { "resourceId": 2, "amount": 25 }
    ],
    "resourceCostsRaw": [30, 0, 25, 0, 0, 0, 0, 0, 0, 0],
    "metadataRevision": 1,
    "enabled": true,
    "verificationStatus": "confirmed",
    "notes": "Confirmed from live CityCrafting recipeOf(2) and getRecipeCosts(2).",
    "display": {
      "outputKindLabel": "Component",
      "requiredFactionLabel": "None",
      "requiredDistrictKindLabel": "None",
      "requiredTechTierLabel": "Primitive",
      "rarityLabel": "None",
      "frameTierLabel": "None"
    }
  }