{
    "schemaVersion": "1.0.0",
    "kind": "recipeDefinition",
    "recipeId": 3,
    "name": "Crystal Core Recipe",
    "slug": "crystal-core-recipe",
    "description": "Component crafting recipe for Crystal Core in the live Inpinity City system.",
    "outputKind": 2,
    "outputId": 3,
    "outputAmount": 1,
    "requiredFaction": 0,
    "requiredDistrictKind": 0,
    "requiredBuildingId": 0,
    "requiredTechTier": 2,
    "rarityTier": 0,
    "frameTier": 0,
    "requiresDiscovery": false,
    "costs": [
      { "resourceId": 0, "amount": 40 },
      { "resourceId": 6, "amount": 20 }
    ],
    "resourceCostsRaw": [40, 0, 0, 0, 0, 0, 20, 0, 0, 0],
    "metadataRevision": 1,
    "enabled": true,
    "verificationStatus": "confirmed",
    "notes": "Confirmed from live CityCrafting recipeOf(3) and getRecipeCosts(3).",
    "display": {
      "outputKindLabel": "Component",
      "requiredFactionLabel": "None",
      "requiredDistrictKindLabel": "None",
      "requiredTechTierLabel": "Refined",
      "rarityLabel": "None",
      "frameTierLabel": "None"
    }
  }